[
  {
    "schema": "synergy.artifact-evidence-envelope/v1",
    "envelope_id": "CONFORMANCE_FINANCIAL_V1_20260829",
    "artifact_type": "financial.available-capacity",
    "artifact_schema": "distribution.available-capacity/v4",
    "artifact_digest": "9f37b95cb7362834acf4ed67c172e12304f730f8b2223d3688a263a49e3328bf",
    "source_repository": "Shtenco/synergy_financial_os",
    "source_commit": "d21ce6b5bd91422c45f938b2d4ec641974106944",
    "producer_repository": "Shtenco/synergy_financial_os",
    "authority_domain": "FINANCIAL_ACCOUNTING",
    "authority_scope": "IDENTITY_AND_PROVENANCE_ONLY",
    "environment": "PREPRODUCTION",
    "evidence_status": "PROVENANCE_ENVELOPE_ONLY",
    "source_status_text": "CONFORMANCE_EXAMPLE_ONLY_NOT_RUNTIME_EVIDENCE",
    "source_verifier_digest": null,
    "observed_at": "2026-08-29T19:21:00Z",
    "parent_digests": [],
    "metadata": {
      "artifact_path": "sinergy_financial_os/distribution_available_capacity_v4.py",
      "content_media_type": "text/x-python",
      "human_label": "Financial OS AvailableCapacity v4 envelope"
    },
    "financial_authority": "NONE",
    "payment_authority": "NONE",
    "accounting_authority": "NONE",
    "execution_authority": "NONE",
    "signing_authority": "NONE",
    "blockchain_submission_authority": "NONE",
    "production_deployment_authority": "NONE",
    "merge_authority": "NONE",
    "envelope_digest": "9037488a54cfbd2aa859a620e77e1b98a67b9908098ec67b0081a1e421030392"
  },
  {
    "schema": "synergy.artifact-evidence-envelope/v1",
    "envelope_id": "CONFORMANCE_METAPAY_V1_20260829",
    "artifact_type": "payment.settlement-reversal",
    "artifact_schema": "distribution.settlement-reversal/v2",
    "artifact_digest": "70f4e50c033f4d4e8a7c5a59b3bd3f622b2327e0b08a6a39ad13fe5fe452e23e",
    "source_repository": "Shtenco/synergy_pay_system",
    "source_commit": "a4b7b2876915e7f70089947a5b40f3cff81458d9",
    "producer_repository": "Shtenco/synergy_pay_system",
    "authority_domain": "SETTLEMENT",
    "authority_scope": "IDENTITY_AND_PROVENANCE_ONLY",
    "environment": "PREPRODUCTION",
    "evidence_status": "PROVENANCE_ENVELOPE_ONLY",
    "source_status_text": "CONFORMANCE_EXAMPLE_ONLY_NOT_LIVE_SETTLEMENT",
    "source_verifier_digest": null,
    "observed_at": "2026-08-29T19:22:00Z",
    "parent_digests": [],
    "metadata": {
      "artifact_path": "fixtures/conformance/settlement_receipt_v2_revenue.json",
      "content_media_type": "application/json",
      "human_label": "MetaPay settlement lineage envelope"
    },
    "financial_authority": "NONE",
    "payment_authority": "NONE",
    "accounting_authority": "NONE",
    "execution_authority": "NONE",
    "signing_authority": "NONE",
    "blockchain_submission_authority": "NONE",
    "production_deployment_authority": "NONE",
    "merge_authority": "NONE",
    "envelope_digest": "692dda0268e79b468cd646c439ea9c6ca9f08d6656e438274c37dda34ff4c41b"
  },
  {
    "schema": "synergy.artifact-evidence-envelope/v1",
    "envelope_id": "CONFORMANCE_BLOCKCHAIN_V1_20260829",
    "artifact_type": "trust.persistent-restart-evidence",
    "artifact_schema": "synergy.economic-testnet-persistent-restart-execution-evidence/v1",
    "artifact_digest": "7c533e6ebb3b3177ef9191d1951c930ddd9d6f49541b0fa3982924f2dce86680",
    "source_repository": "Shtenco/synergy_ai_blockchain",
    "source_commit": "72a7853fba49d20c208bd2d9776d6c107648b882",
    "producer_repository": "Shtenco/synergy_ai_blockchain",
    "authority_domain": "TRUST_COMMITMENT",
    "authority_scope": "IDENTITY_AND_PROVENANCE_ONLY",
    "environment": "LOCAL_TEST",
    "evidence_status": "PROVENANCE_ENVELOPE_ONLY",
    "source_status_text": "LOCAL_DISK_PERSISTENCE_RESTART_RECOVERY_VERIFIED_NOT_EXTERNAL_HOST_TESTNET",
    "source_verifier_digest": null,
    "observed_at": "2026-08-29T19:23:00Z",
    "parent_digests": [],
    "metadata": {
      "artifact_path": "registry/economic_testnet_persistent_restart_execution_evidence_v1.json",
      "content_media_type": "application/json",
      "human_label": "Economic testnet local persistence evidence envelope"
    },
    "financial_authority": "NONE",
    "payment_authority": "NONE",
    "accounting_authority": "NONE",
    "execution_authority": "NONE",
    "signing_authority": "NONE",
    "blockchain_submission_authority": "NONE",
    "production_deployment_authority": "NONE",
    "merge_authority": "NONE",
    "envelope_digest": "1d1f926b1f4463aff456e8542d76c745f5b1d85c629b338741c9ae6af42f41a6"
  },
  {
    "schema": "synergy.artifact-evidence-envelope/v1",
    "envelope_id": "CONFORMANCE_NEXUS_V1_20260829",
    "artifact_type": "ai.benchmark-record",
    "artifact_schema": "nexus.ru1500-postinference-record/v1",
    "artifact_digest": "afb073f1e032959207c699cdfdf7f7c91549108fd81c56ed1dea69c47b1d426d",
    "source_repository": "Shtenco/agi_nexus",
    "source_commit": "cb40a53ce9d0d628e892e0a8631b73e9058c38b8",
    "producer_repository": "Shtenco/agi_nexus",
    "authority_domain": "AI_INFERENCE",
    "authority_scope": "IDENTITY_AND_PROVENANCE_ONLY",
    "environment": "RESEARCH",
    "evidence_status": "PROVENANCE_ENVELOPE_ONLY",
    "source_status_text": "RESEARCH_BENCHMARK_RECORD_NOT_GENERAL_AGI_CLAIM",
    "source_verifier_digest": null,
    "observed_at": "2026-08-29T19:24:00Z",
    "parent_digests": [],
    "metadata": {
      "artifact_path": "records/NEXUS_RU1500_POSTINFERENCE_2026-08-24.md",
      "content_media_type": "text/markdown",
      "human_label": "NEXUS Russian benchmark record envelope"
    },
    "financial_authority": "NONE",
    "payment_authority": "NONE",
    "accounting_authority": "NONE",
    "execution_authority": "NONE",
    "signing_authority": "NONE",
    "blockchain_submission_authority": "NONE",
    "production_deployment_authority": "NONE",
    "merge_authority": "NONE",
    "envelope_digest": "b78ee54357e41dd8ffe5dfc2d86152cc17d7769d597d6c9dcbbb7139d20abbe0"
  },
  {
    "schema": "synergy.artifact-evidence-envelope/v1",
    "envelope_id": "CONFORMANCE_MIDAS_V1_20260829",
    "artifact_type": "trading.research-record",
    "artifact_schema": "midas.v19.3-session-junction-research/v1",
    "artifact_digest": "da35f60cc67e246b52154298c22bae08842cbf90473614da7921dda71f87efe8",
    "source_repository": "Shtenco/midas_ai",
    "source_commit": "513f3ac922be8a85339b1848fe2d09d7a486ed91",
    "producer_repository": "Shtenco/midas_ai",
    "authority_domain": "TRADING_PROPOSAL",
    "authority_scope": "IDENTITY_AND_PROVENANCE_ONLY",
    "environment": "RESEARCH",
    "evidence_status": "PROVENANCE_ENVELOPE_ONLY",
    "source_status_text": "RESEARCH_SHADOW_ONLY_LOCAL_ARTIFACT_NOT_UPLOADED",
    "source_verifier_digest": null,
    "observed_at": "2026-08-29T19:25:00Z",
    "parent_digests": [],
    "metadata": {
      "artifact_path": "research/v19_3_session_junction_microstructure/README.md",
      "content_media_type": "text/markdown",
      "human_label": "MIDAS V19.3 research record envelope"
    },
    "financial_authority": "NONE",
    "payment_authority": "NONE",
    "accounting_authority": "NONE",
    "execution_authority": "NONE",
    "signing_authority": "NONE",
    "blockchain_submission_authority": "NONE",
    "production_deployment_authority": "NONE",
    "merge_authority": "NONE",
    "envelope_digest": "8096833e58dd884552a9d001fbb29d66f13ca13b433981fc1e6600481bc4faaf"
  },
  {
    "schema": "synergy.artifact-evidence-envelope/v1",
    "envelope_id": "CONFORMANCE_UI_V1_20260829",
    "artifact_type": "client.release-metadata",
    "artifact_schema": "sinergy.finance.store-release/v8.1.0",
    "artifact_digest": "90ff53b27d31492529163be51d6696e087d80baec840f781bfc0c5bce0b7906d",
    "source_repository": "Shtenco/synergy_app",
    "source_commit": "700da9dfbb259413af661676bc0d88f280fef4e0",
    "producer_repository": "Shtenco/synergy_app",
    "authority_domain": "CLIENT_PRESENTATION",
    "authority_scope": "IDENTITY_AND_PROVENANCE_ONLY",
    "environment": "STAGING",
    "evidence_status": "PROVENANCE_ENVELOPE_ONLY",
    "source_status_text": "STORE_RELEASE_METADATA_NOT_FINANCIAL_AUTHORITY",
    "source_verifier_digest": null,
    "observed_at": "2026-08-29T19:26:00Z",
    "parent_digests": [],
    "metadata": {
      "artifact_path": "README.md",
      "content_media_type": "text/markdown",
      "human_label": "SINERGY Finance 8.1 release metadata envelope"
    },
    "financial_authority": "NONE",
    "payment_authority": "NONE",
    "accounting_authority": "NONE",
    "execution_authority": "NONE",
    "signing_authority": "NONE",
    "blockchain_submission_authority": "NONE",
    "production_deployment_authority": "NONE",
    "merge_authority": "NONE",
    "envelope_digest": "d97dee7302fcc2508797a941ad45b8b09707c23b2bebff32b96f515eb563320d"
  }
]
